{
  "schema_version": 1,
  "currency": "RUB_kopeks",
  "fixture_only_no_runtime_inputs": true,
  "rounding": "Decimal ROUND_HALF_UP per stream-month, variable cost per stream-month, score once at final",
  "modes": {
    "baseline": "No attack, no defense; must match data/startups.json exactly",
    "weak_local_one_stream": "In month 1 weak=1200bps*local=4000bps*plausible=8000bps*normal=10000bps => 384bps direct only first stream, temporary decay 6000bps (384,230,138), no defense",
    "structural_95pct_all_streams": "TEST ONLY: prevalidated independent structural 9500bps on both streams from month 1, no defense; cannot be generated by arbitrary player text"
  },
  "cases": [
    {
      "startup_slug": "coffeebot",
      "mode": "baseline",
      "forced_defense": "none",
      "opening_cash_kopeks": 750000000,
      "monthly_ledger": [
        {
          "month": 1,
          "streams": [
            {
              "id": "kiosks",
              "baseline_revenue_kopeks": 195000000,
              "shock_bps": 0,
              "revenue_kopeks": 195000000,
              "variable_cost_kopeks": 68250000
            },
            {
              "id": "service",
              "baseline_revenue_kopeks": 55000000,
              "shock_bps": 0,
              "revenue_kopeks": 55000000,
              "variable_cost_kopeks": 19250000
            }
          ],
          "revenue_kopeks": 250000000,
          "variable_cost_kopeks": 87500000,
          "fixed_cost_kopeks": 200000000,
          "profit_kopeks": -37500000,
          "closing_cash_kopeks": 712500000,
          "unpaid_obligations_kopeks": 0
        },
        {
          "month": 2,
          "streams": [
            {
              "id": "kiosks",
              "baseline_revenue_kopeks": 196950000,
              "shock_bps": 0,
              "revenue_kopeks": 196950000,
              "variable_cost_kopeks": 68932500
            },
            {
              "id": "service",
              "baseline_revenue_kopeks": 55550000,
              "shock_bps": 0,
              "revenue_kopeks": 55550000,
              "variable_cost_kopeks": 19442500
            }
          ],
          "revenue_kopeks": 252500000,
          "variable_cost_kopeks": 88375000,
          "fixed_cost_kopeks": 200000000,
          "profit_kopeks": -35875000,
          "closing_cash_kopeks": 676625000,
          "unpaid_obligations_kopeks": 0
        },
        {
          "month": 3,
          "streams": [
            {
              "id": "kiosks",
              "baseline_revenue_kopeks": 198919500,
              "shock_bps": 0,
              "revenue_kopeks": 198919500,
              "variable_cost_kopeks": 69621825
            },
            {
              "id": "service",
              "baseline_revenue_kopeks": 56105500,
              "shock_bps": 0,
              "revenue_kopeks": 56105500,
              "variable_cost_kopeks": 19636925
            }
          ],
          "revenue_kopeks": 255025000,
          "variable_cost_kopeks": 89258750,
          "fixed_cost_kopeks": 200000000,
          "profit_kopeks": -34233750,
          "closing_cash_kopeks": 642391250,
          "unpaid_obligations_kopeks": 0
        },
        {
          "month": 4,
          "streams": [
            {
              "id": "kiosks",
              "baseline_revenue_kopeks": 200908695,
              "shock_bps": 0,
              "revenue_kopeks": 200908695,
              "variable_cost_kopeks": 70318043
            },
            {
              "id": "service",
              "baseline_revenue_kopeks": 56666555,
              "shock_bps": 0,
              "revenue_kopeks": 56666555,
              "variable_cost_kopeks": 19833294
            }
          ],
          "revenue_kopeks": 257575250,
          "variable_cost_kopeks": 90151337,
          "fixed_cost_kopeks": 200000000,
          "profit_kopeks": -32576087,
          "closing_cash_kopeks": 609815163,
          "unpaid_obligations_kopeks": 0
        },
        {
          "month": 5,
          "streams": [
            {
              "id": "kiosks",
              "baseline_revenue_kopeks": 202917782,
              "shock_bps": 0,
              "revenue_kopeks": 202917782,
              "variable_cost_kopeks": 71021224
            },
            {
              "id": "service",
              "baseline_revenue_kopeks": 57233221,
              "shock_bps": 0,
              "revenue_kopeks": 57233221,
              "variable_cost_kopeks": 20031627
            }
          ],
          "revenue_kopeks": 260151003,
          "variable_cost_kopeks": 91052851,
          "fixed_cost_kopeks": 200000000,
          "profit_kopeks": -30901848,
          "closing_cash_kopeks": 578913315,
          "unpaid_obligations_kopeks": 0
        },
        {
          "month": 6,
          "streams": [
            {
              "id": "kiosks",
              "baseline_revenue_kopeks": 204946960,
              "shock_bps": 0,
              "revenue_kopeks": 204946960,
              "variable_cost_kopeks": 71731436
            },
            {
              "id": "service",
              "baseline_revenue_kopeks": 57805553,
              "shock_bps": 0,
              "revenue_kopeks": 57805553,
              "variable_cost_kopeks": 20231944
            }
          ],
          "revenue_kopeks": 262752513,
          "variable_cost_kopeks": 91963380,
          "fixed_cost_kopeks": 200000000,
          "profit_kopeks": -29210867,
          "closing_cash_kopeks": 549702448,
          "unpaid_obligations_kopeks": 0
        },
        {
          "month": 7,
          "streams": [
            {
              "id": "kiosks",
              "baseline_revenue_kopeks": 206996429,
              "shock_bps": 0,
              "revenue_kopeks": 206996429,
              "variable_cost_kopeks": 72448750
            },
            {
              "id": "service",
              "baseline_revenue_kopeks": 58383608,
              "shock_bps": 0,
              "revenue_kopeks": 58383608,
              "variable_cost_kopeks": 20434263
            }
          ],
          "revenue_kopeks": 265380037,
          "variable_cost_kopeks": 92883013,
          "fixed_cost_kopeks": 200000000,
          "profit_kopeks": -27502976,
          "closing_cash_kopeks": 522199472,
          "unpaid_obligations_kopeks": 0
        },
        {
          "month": 8,
          "streams": [
            {
              "id": "kiosks",
              "baseline_revenue_kopeks": 209066394,
              "shock_bps": 0,
              "revenue_kopeks": 209066394,
              "variable_cost_kopeks": 73173238
            },
            {
              "id": "service",
              "baseline_revenue_kopeks": 58967444,
              "shock_bps": 0,
              "revenue_kopeks": 58967444,
              "variable_cost_kopeks": 20638605
            }
          ],
          "revenue_kopeks": 268033838,
          "variable_cost_kopeks": 93811843,
          "fixed_cost_kopeks": 200000000,
          "profit_kopeks": -25778005,
          "closing_cash_kopeks": 496421467,
          "unpaid_obligations_kopeks": 0
        },
        {
          "month": 9,
          "streams": [
            {
              "id": "kiosks",
              "baseline_revenue_kopeks": 211157058,
              "shock_bps": 0,
              "revenue_kopeks": 211157058,
              "variable_cost_kopeks": 73904970
            },
            {
              "id": "service",
              "baseline_revenue_kopeks": 59557119,
              "shock_bps": 0,
              "revenue_kopeks": 59557119,
              "variable_cost_kopeks": 20844992
            }
          ],
          "revenue_kopeks": 270714177,
          "variable_cost_kopeks": 94749962,
          "fixed_cost_kopeks": 200000000,
          "profit_kopeks": -24035785,
          "closing_cash_kopeks": 472385682,
          "unpaid_obligations_kopeks": 0
        }
      ],
      "closing_cash_kopeks": 472385682,
      "bankruptcy_month": null,
      "score": {
        "damage": 0.0,
        "solvency": 0.0,
        "early_bankruptcy": 0.0,
        "score": 0
      }
    },
    {
      "startup_slug": "coffeebot",
      "mode": "weak_local_one_stream",
      "forced_defense": "none",
      "opening_cash_kopeks": 750000000,
      "monthly_ledger": [
        {
          "month": 1,
          "streams": [
            {
              "id": "kiosks",
              "baseline_revenue_kopeks": 195000000,
              "shock_bps": 384,
              "revenue_kopeks": 187512000,
              "variable_cost_kopeks": 65629200
            },
            {
              "id": "service",
              "baseline_revenue_kopeks": 55000000,
              "shock_bps": 0,
              "revenue_kopeks": 55000000,
              "variable_cost_kopeks": 19250000
            }
          ],
          "revenue_kopeks": 242512000,
          "variable_cost_kopeks": 84879200,
          "fixed_cost_kopeks": 200000000,
          "profit_kopeks": -42367200,
          "closing_cash_kopeks": 707632800,
          "unpaid_obligations_kopeks": 0
        },
        {
          "month": 2,
          "streams": [
            {
              "id": "kiosks",
              "baseline_revenue_kopeks": 196950000,
              "shock_bps": 230,
              "revenue_kopeks": 192420150,
              "variable_cost_kopeks": 67347053
            },
            {
              "id": "service",
              "baseline_revenue_kopeks": 55550000,
              "shock_bps": 0,
              "revenue_kopeks": 55550000,
              "variable_cost_kopeks": 19442500
            }
          ],
          "revenue_kopeks": 247970150,
          "variable_cost_kopeks": 86789553,
          "fixed_cost_kopeks": 200000000,
          "profit_kopeks": -38819403,
          "closing_cash_kopeks": 668813397,
          "unpaid_obligations_kopeks": 0
        },
        {
          "month": 3,
          "streams": [
            {
              "id": "kiosks",